{
  "$schema": "https://json-schema.org/draft/2020-12/schema",
  "$id": "https://devcareer-prep.local/schemas/config.schema.json",
  "title": "DevCareer Prep Run Configuration",
  "description": "저자 정체성 게이트(§5)·볼륨 통제(§4)·저장 위치 동의(§6)의 확정 결과를 담는 설정 파일(config.json). 저장 루트 정본 ~/.devcareer/<repo-key>/(또는 명시 동의 시 <repo>/.devcareer/) 아래에 evidence.json·state.json과 함께 놓인다. config.json은 '산출물'(evidence/career/knowledge-map/gap-report/plan)이 아니므로 sourceRepoHead·contentHash·coverage·truncated 공통 계약을 따르지 않는다. AC-15에 따라 이 파일 전체에 로컬 절대경로 필드를 두지 않는다 — 대상 레포 식별은 저장 루트 위치(repo-key) 자체가 담당하며 scripts/lib/store.mjs 한 곳에서만 해석된다.",
  "type": "object",
  "additionalProperties": false,
  "required": [
    "schemaVersion", "updatedAt", "identitySelection", "scope", "budget",
    "includeDiff", "exclusions", "storage", "snippetQuoting"
  ],
  "properties": {
    "schemaVersion": {
      "type": "string",
      "pattern": "^\\d+\\.\\d+\\.\\d+$",
      "default": "0.1.0",
      "description": "이 설정 파일 형식의 버전."
    },
    "updatedAt": {
      "type": "string",
      "format": "date-time",
      "description": "이 설정이 마지막으로(재)확정된 시각."
    },
    "identitySelection": {
      "type": "object",
      "additionalProperties": false,
      "required": ["candidates", "selected"],
      "description": "§5 저자 정체성 게이트: `git shortlog -sne` 후보 제시 → 사용자 다중 선택(추측 금지).",
      "properties": {
        "candidates": {
          "type": "array",
          "description": "게이트 시점에 제시된 `git shortlog -sne` 후보 전체(감사 기록용).",
          "items": {
            "type": "object",
            "additionalProperties": false,
            "required": ["name", "email", "commitCount"],
            "properties": {
              "name": { "type": "string", "x-verbatim": true, "description": "git author.name 원문." },
              "email": { "type": "string", "format": "email" },
              "commitCount": { "type": "integer", "minimum": 0 }
            }
          }
        },
        "selected": {
          "type": "array",
          "items": { "type": "string", "format": "email" },
          "description": "사용자가 다중 선택한 본인 identity 이메일. 이 집합이 evidence.json (a)축(저자 대조)의 정본이다. 빈 배열은 게이트 미완료 상태를 뜻하며 그 상태로는 수집기를 실행하지 않는다."
        }
      }
    },
    "scope": {
      "type": "object",
      "additionalProperties": false,
      "required": ["ref", "mergeIncluded", "since", "until"],
      "description": "§5: HEAD/--all·머지 포함 여부·기간을 identity 선택과 함께 이 시점에 확정한다.",
      "properties": {
        "ref": {
          "type": "string",
          "enum": ["HEAD", "--all"],
          "description": "순회 범위. --first-parent는 어떤 설정에도 쓰지 않는다(사이드 브랜치 소실 방지)."
        },
        "mergeIncluded": {
          "type": "boolean",
          "description": "머지 커밋 포함 여부. 순회 필터가 아니라 excluded 판정·정량 집계 반영 여부만 결정한다(구현 5단계). false를 선택하면 머지 해시 인용은 (a)축에서 무조건 FAIL 처리된다."
        },
        "since": {
          "type": ["string", "null"],
          "format": "date",
          "description": "조회 시작일. 미지정이면 null(전체 기간)."
        },
        "until": {
          "type": ["string", "null"],
          "format": "date",
          "description": "조회 종료일. 미지정이면 null."
        }
      }
    },
    "budget": {
      "type": "object",
      "additionalProperties": false,
      "required": ["maxCommits"],
      "description": "P0 예산 파라미터는 max_commits 단일 축이다. 샘플링 비율 상수(recent40/churn40/even20)는 정본 샘플링 리터럴에 고정되어 있으며 사용자 조정 대상이 아니다 — 비율을 파라미터화하면 기재되는 samplingMethod 리터럴과 실제 선택 규칙이 어긋난다.",
      "properties": {
        "maxCommits": {
          "type": "integer",
          "minimum": 1,
          "description": "K 산정에 쓰이는 예산 상한(`K = min(maxCommits, total)`). 바이트 상한·파일 수 상한은 P1로 연기되어 이 스키마에 없다."
        }
      }
    },
    "includeDiff": {
      "type": "boolean",
      "default": false,
      "description": "--no-diff 모드가 P0 기본값이다(false). 현재는 P0에 diff 원문 수집 경로 자체가 없어(evidence.schema.json이 diff 원문을 담지 않는다) 이 값은 collect-git-facts.mjs에서 관측 가능한 산출물 차이를 만들지 않는 자리표시자다 — CLI에도 노출하지 않는다(구현 시점까지). 구현되면 snippetQuoting과 동일하게 scripts/lib/redact.mjs로 마스킹할 계획이다."
    },
    "exclusions": {
      "type": "object",
      "additionalProperties": false,
      "required": ["bots", "vendoredPaths"],
      "description": "봇 패턴과 vendored 경로는 기본 제외하되 조정 가능하다(§5).",
      "properties": {
        "bots": {
          "type": "boolean",
          "default": true,
          "description": "[bot]/dependabot/github-actions 패턴 기본 제외."
        },
        "vendoredPaths": {
          "type": "boolean",
          "default": true,
          "description": "node_modules/dist/vendor/*.lock/migrations 등 vendored 경로 기본 제외."
        },
        "customBotPatterns": {
          "type": "array",
          "items": { "type": "string", "x-verbatim": true },
          "description": "사용자가 추가한 봇 이메일/이름 패턴(선택)."
        },
        "customVendoredPaths": {
          "type": "array",
          "items": { "type": "string", "x-verbatim": true },
          "description": "사용자가 추가한 vendored 경로 glob 패턴(선택)."
        }
      }
    },
    "storage": {
      "type": "object",
      "additionalProperties": false,
      "required": ["root", "repoOptIn"],
      "description": "§6·§9·AC-15 저장 위치 동의 기록. 루트 자체의 절대경로 값은 여기 저장하지 않는다(scripts/lib/store.mjs가 실행 시 해석) — 여기서는 어느 모드가 선택됐는지만 기록한다.",
      "properties": {
        "root": {
          "type": "string",
          "enum": ["home", "repo"],
          "default": "home",
          "description": "home = ~/.devcareer/<repo-key>/(기본, 프라이버시 기본값). repo = <repo>/.devcareer/(명시 동의 시에만 전환, 홈·레포 혼재 금지 — 전환 시 그 실행의 파일 전부가 함께 레포 내부로 간다)."
        },
        "repoOptIn": {
          "type": "boolean",
          "default": false,
          "description": "root:repo를 선택하려면 반드시 true여야 하는 명시 동의 플래그. 동의 시 대상 레포 .gitignore에 항목 추가를 제안한다."
        }
      },
      "allOf": [
        {
          "if": { "properties": { "root": { "const": "repo" } } },
          "then": { "properties": { "repoOptIn": { "const": true } } }
        }
      ]
    },
    "snippetQuoting": {
      "type": "boolean",
      "default": false,
      "description": "코드 원문(diff) 인용 옵트인 플래그. 기본 false(경로+해시+요약만). P0에는 diff 인용 경로 자체가 아직 구현되지 않았다 — evidence.schema.json은 diff 원문을 담지 않으며, 이 플래그는 구현 7단계 이후를 위한 자리표시자다. 그 경로가 구현되면 scripts/lib/redact.mjs(현재 collect-git-facts.mjs가 커밋 subject·coAuthors 마스킹에 이미 쓰는 동일 모듈)를 재사용해 마스킹을 적용할 계획이다. 이 플래그와 무관하게 커밋 subject·coAuthors의 알려진 시크릿/PII 패턴은 원장 기록 시점에 항상 마스킹된다(evidence.schema.json의 commit.subject/coAuthors 참조)."
    }
  }
}
